{
  "id": "bianca_tv_noitems",
  "scene": "B",
  "acceptance": [
    5
  ],
  "persona": "bianca",
  "merchant_raw": "PAYU*EMAG.RO",
  "mcc": "5732",
  "direction": "debit",
  "amount": 4500.00,
  "items": null,
  "day_offset": 0,
  "time": "18:45",
  "requires": [],
  "expected": {
    "merchant_id": "emag",
    "category": "electronics",
    "decision": "ask",
    "ask_what_item": true
  },
  "notes": "eMAG is multi-category and there are no items (D32): the question asks what it was."
}
