{
  "id": "andrei_tv",
  "scene": "B",
  "acceptance": [
    3
  ],
  "persona": "andrei",
  "merchant_raw": "PAYU*EMAG.RO",
  "mcc": "5732",
  "direction": "debit",
  "amount": 4500.00,
  "items": [
    {
      "name": "Televizor 65\"",
      "qty": 1,
      "amount": 4500.00
    }
  ],
  "day_offset": 0,
  "time": "18:30",
  "requires": [],
  "expected": {
    "merchant_id": "emag",
    "category": "electronics",
    "decision": "inform",
    "purpose": "work_tool"
  },
  "notes": "Scene B: the TV is a work tool for a sports analyst; a quiet card, no question."
}
